{
  "$schema": "https://json-schema.org/draft/2020-12/schema",
  "$id": "https://ticketly.dev/schema/house-style.schema.json",
  "title": "Ticketly House Style",
  "description": "How a team writes tickets: the effort rubric (what each Fibonacci point means), the optional hours-based difficulty rubric and estimating rules, the default ticket-ID prefix vocabulary to suggest from, the tone rules for titles/descriptions/acceptance criteria, and a pointer to a few-shot example backlog. Ticketly reads this so generated tickets match the team's voice. A default ships in house-style/default.json; a project may override it.",
  "type": "object",
  "required": ["effort_rubric", "prefix_vocab", "tone", "few_shot"],
  "additionalProperties": false,
  "properties": {
    "effort_rubric": {
      "type": "object",
      "additionalProperties": false,
      "required": ["1", "2", "3", "5", "8", "13"],
      "description": "What each Fibonacci point means for this team, so 'M' means the same thing every time. Epics (0) are sized by their children and are not listed here.",
      "properties": {
        "1": { "type": "string", "minLength": 1 },
        "2": { "type": "string", "minLength": 1 },
        "3": { "type": "string", "minLength": 1 },
        "5": { "type": "string", "minLength": 1 },
        "8": { "type": "string", "minLength": 1 },
        "13": { "type": "string", "minLength": 1 }
      }
    },
    "prefix_vocab": {
      "type": "array",
      "minItems": 1,
      "description": "The team's default ticket-ID prefix vocabulary. Ticketly suggests from these (filtered to the project's actual layers) and the user confirms. Project-specific domain prefixes can be added at profile time.",
      "items": {
        "type": "object",
        "additionalProperties": false,
        "required": ["prefix", "domain"],
        "properties": {
          "prefix": {
            "type": "string",
            "pattern": "^[A-Z]{2,5}$",
            "description": "2-5 uppercase letters, e.g. 'ARC', 'API', 'INF'."
          },
          "domain": {
            "type": "string",
            "minLength": 1,
            "description": "What this prefix groups, e.g. 'Architecture & core conventions'."
          },
          "domain_specific": {
            "type": "boolean",
            "default": false,
            "description": "True for prefixes tied to a particular product domain (e.g. OCR). Suggested only when the project clearly has that domain."
          }
        }
      }
    },
    "tone": {
      "type": "object",
      "additionalProperties": false,
      "required": ["title", "description", "acceptance_criteria"],
      "description": "Plain-language rules describing how each field should read, derived from the team's real tickets.",
      "properties": {
        "title": { "type": "string", "minLength": 1 },
        "description": { "type": "string", "minLength": 1 },
        "acceptance_criteria": { "type": "string", "minLength": 1 }
      }
    },
    "hours_rubric": {
      "type": "object",
      "additionalProperties": false,
      "required": ["version", "levels", "guidance"],
      "description": "OPTIONAL. Guidance for hours-based points: the difficulty levels (name, multiplier, technical requirements) and the rules for estimating standard hours. The multipliers mirror the engine's calculation rubric; a backlog freezes the rubric it was estimated under.",
      "properties": {
        "version": { "type": "string", "minLength": 1 },
        "levels": {
          "type": "object",
          "additionalProperties": false,
          "required": ["1", "2", "3", "4"],
          "properties": {
            "1": { "$ref": "#/$defs/level" },
            "2": { "$ref": "#/$defs/level" },
            "3": { "$ref": "#/$defs/level" },
            "4": { "$ref": "#/$defs/level" }
          }
        },
        "guidance": {
          "type": "array",
          "minItems": 1,
          "items": { "type": "string", "minLength": 1 },
          "description": "Rules for consistent scoring: standard hours, the breakdown, difficulty evidence, confidence, independence from the person."
        }
      }
    },
    "hours_few_shot": {
      "type": "object",
      "additionalProperties": false,
      "required": ["backlog"],
      "description": "OPTIONAL. Pointer to an example hours-based backlog.",
      "properties": {
        "backlog": { "type": "string", "minLength": 1 }
      }
    },
    "few_shot": {
      "type": "object",
      "additionalProperties": false,
      "required": ["backlog"],
      "description": "Pointer to a worked example backlog (valid against the ticket schema) that demonstrates the team's voice. Used as few-shot during generation.",
      "properties": {
        "backlog": {
          "type": "string",
          "minLength": 1,
          "description": "Repo-relative path to the example backlog JSON, e.g. 'examples/house-style-backlog.json'."
        }
      }
    }
  },
  "$defs": {
    "level": {
      "type": "object",
      "additionalProperties": false,
      "required": ["name", "multiplier", "requirements"],
      "properties": {
        "name": { "type": "string", "minLength": 1 },
        "multiplier": { "type": "string", "pattern": "^[0-9]+\\.[0-9]{2}$" },
        "requirements": { "type": "string", "minLength": 1 }
      }
    }
  }
}
